semtag,id,term,DefStatusobservable entity,4061000175103,Date of last foot examination (observable entity),Primitivedisorder,41931000119102,Sinusitis co-occurrent with nasal polyps (disorder),Sufficiently defineddisorder,430961000124105,Cheilitis due to lupus erythematosus (disorder),Sufficiently defineddisorder,433981000124105,High attachment of labial frenum (disorder),Primitivedisorder,46551000119106,Defect of skin of hand (disorder),Sufficiently definedfinding,48031000119106,Ex-smoker for more than 1 year (finding),Primitivesituation,48811000119106,History of acromegaly (situation),Sufficiently definedsituation,48901000119103,History of invasive malignant neoplasm of breast (situation),Primitivesituation,48951000119104,History of malignant neoplasm of meninges (situation),Sufficiently definedsituation,49071000119104,History of pituitary dependent hypercortisolism (situation),Sufficiently definedsituation,49081000119101,History of Cushing syndrome (situation),Sufficiently definedsituation,49101000119108,History of hepatoblastoma (situation),Sufficiently definedsituation,49111000119106,History of hepatocellular carcinoma (situation),Sufficiently definedsituation,49121000119104,History of histiocytosis (situation),Sufficiently definedsituation,49191000119102,History of neutropenia (situation),Sufficiently definedsituation,49201000119104,History of neoplasm of pituitary gland (situation),Sufficiently definedsituation,49231000119106,History of primary hyperparathyroidism (situation),Sufficiently definedsituation,49241000119102,History of prolactinoma (situation),Sufficiently definedsituation,49291000119105,History of soft tissue sarcoma (situation),Sufficiently definedsituation,53261000119103,History of external beam radiation therapy (situation),Sufficiently definedsituation,53271000119109,History of cervical epidural steroid injection (situation),Sufficiently definedsituation,53281000119107,History of lumbar epidural steroid injection (situation),Sufficiently definedsituation,53371000119101,History of orthopedic surgery (situation),Sufficiently defineddisorder,5391000119108,Nonallergic eczema (disorder),Primitivedisorder,5661000124106,Smoker's melanosis (disorder),Sufficiently definedfinding,5671000124104,Minimally compromised occlusal scheme (finding),Primitivesituation,59141000119107,History of spinal fusion (situation),Sufficiently definedsituation,59151000119109,History of hernia repair (situation),Sufficiently definedsituation,59161000119106,History of sterilization (situation),Sufficiently definedsituation,59211000119103,History of fusion of thoracic spine (situation),Sufficiently definedsituation,59251000119102,History of loop electrosurgical excision procedure (situation),Sufficiently definedsituation,59271000119106,History of lumbar fusion (situation),Sufficiently definedsituation,59301000119108,History of prostate needle biopsy with negative result (situation),Primitivesituation,59381000119100,History of urinary bladder augmentation (situation),Sufficiently definedsituation,59601000119103,History of germ cell tumor (situation),Sufficiently definedsituation,59641000119101,History of tracheoesophageal fistula (situation),Sufficiently definedsituation,59651000119104,History of benign carcinoid neoplasm of gastrointestinal tract (situation),Sufficiently definedsituation,59701000119109,History of portal hypertension (situation),Sufficiently definedsituation,59711000119107,History of pseudoaneurysm (situation),Sufficiently definedsituation,59721000119100,History of thoracoabdominal aortic aneurysm (situation),Sufficiently definedsituation,59741000119106,History of visceral aneurysm (situation),Primitivesituation,59801000119102,History of small vessel disease due to diabetes mellitus (situation),Primitivedisorder,6011000119108,Transient arthritis (disorder),Sufficiently defineddisorder,6051000119109,Chronic ulcer of calf (disorder),Sufficiently definedfinding,60631000119109,Dependence on home ventilator (finding),Primitivefinding,60651000119103,Dependence on continuous supplemental oxygen (finding),Primitivesituation,60681000119105,History of spinal cord injury (situation),Sufficiently defineddisorder,6071000119100,Upper respiratory tract allergy (disorder),Sufficiently definedsituation,63581000119104,History of chronic lymphocytic leukemia (situation),Sufficiently definedsituation,63901000119104,Family history of Tay-Sachs disease (situation),Sufficiently definedsituation,63921000119108,Family history of Rett syndrome (situation),Sufficiently definedsituation,63941000119102,Family history of congenital hydrocephalus (situation),Sufficiently definedsituation,64021000119106,Family history of neurological developmental delay (situation),Primitivesituation,64041000119100,Family history of complex congenital heart disease (situation),Primitivesituation,64081000119105,Family history of galactosemia (situation),Sufficiently definedfinding,641000119106,Intermittent asthma well controlled (finding),Primitivesituation,64111000119100,Family history of combined hyperlipidemia (situation),Sufficiently definedsituation,64121000119107,Family history of achondroplasia (situation),Sufficiently definedsituation,64131000119105,Family history of methylmalonic aciduria (situation),Sufficiently definedsituation,64161000119102,Family history of phenylketonuria (situation),Sufficiently definedsituation,64181000119106,Family history of Marfan syndrome (situation),Sufficiently definedsituation,64251000119106,Family history of glycogen storage disease (situation),Sufficiently definedsituation,64371000119105,Family history of beta thalassemia (situation),Sufficiently definedsituation,64431000119101,Family history of alpha thalassemia (situation),Sufficiently definedsituation,64501000119109,Family history of hemoglobinopathy (situation),Sufficiently definedsituation,64521000119100,Family history of Von Willebrand disease (situation),Sufficiently definedsituation,64571000119104,Family history of abdominal wall defect (situation),Primitivesituation,64651000119109,Family history of ambiguous genitalia (situation),Sufficiently definedsituation,64851000119105,Family history of Prader-Willi syndrome (situation),Sufficiently definedsituation,64911000119103,Family history of cystic hygroma (situation),Sufficiently definedsituation,65001000119101,Family history of connective tissue disorder (situation),Sufficiently definedsituation,65011000119103,Family history of autosomal aneuploidy (situation),Sufficiently definedsituation,65021000119105,Family history of neurofibromatosis (situation),Sufficiently definedsituation,65071000119106,Family history of fragile X syndrome (situation),Sufficiently definedsituation,65501000119108,History of breast reconstruction (situation),Sufficiently definedprocedure,669251000168104,Defense force post-deployment medical examination (procedure),Primitiveprocedure,669261000168102,Defense force preliminary post-deployment medical examination (procedure),Primitiveprocedure,669271000168108,Defense force pre-deployment medical examination (procedure),Primitiveprocedure,669281000168106,Defense force preliminary pre-deployment medical examination (procedure),Primitiveprocedure,669311000168108,Defense force pre-deployment health assessment (procedure),Primitiveprocedure,669321000168101,Defense force pre-deployment health screen (procedure),Primitivesituation,672261000119100,History of repair of aneurysm of thoracoabdominal aorta (situation),Sufficiently definedsituation,67231000119106,History of extracorporeal membrane oxygenation (situation),Sufficiently definedsituation,674191000119109,History of syncope (situation),Sufficiently definedsituation,681201000119104,History of prostatitis (situation),Sufficiently definedsituation,681211000119101,History of myocarditis (situation),Sufficiently definedsituation,681221000119108,History of herpes zoster (situation),Sufficiently definedsituation,681291000119105,History of mycosis fungoides (situation),Sufficiently definedsituation,681341000119108,History of cornea graft failure (situation),Sufficiently definedsituation,681381000119103,History of infection of total knee joint prothesis (situation),Sufficiently definedsituation,690051000119100,History of cerebellar stroke (situation),Primitivesituation,690461000119106,History of bradycardia (situation),Sufficiently definedsituation,690471000119100,History of fusion of thoracolumbar spine (situation),Sufficiently definedsituation,690481000119102,History of carotid artery dissection (situation),Primitivesituation,690491000119104,History of cardiomyopathy (situation),Sufficiently definedsituation,690501000119106,History of open prostatectomy (situation),Sufficiently definedsituation,690511000119109,History of radical prostatectomy (situation),Sufficiently definedsituation,690711000119103,History of acquired spondylolisthesis (situation),Sufficiently definedsituation,691171000119104,History of pulmonary valvuloplasty (situation),Sufficiently definedsituation,691191000119103,History of pituitary adenoma (situation),Sufficiently definedsituation,691201000119100,History of adrenal adenoma (situation),Sufficiently definedsituation,691291000119106,History of adrenalectomy (situation),Sufficiently definedsituation,691371000119102,History of malignant neoplasm of parotid gland (situation),Sufficiently definedsituation,691491000119105,History of esophagitis (situation),Sufficiently definedsituation,691501000119103,History of gastritis (situation),Sufficiently definedsituation,69551000119109,History of squamous cell carcinoma (situation),Sufficiently definedsituation,69731000119107,Family history of short stature (situation),Sufficiently definedsituation,69751000119101,History of radical nephrectomy (situation),Sufficiently definedsituation,70561000119109,History of heartburn (situation),Sufficiently definedsituation,70661000119105,History of arthrodesis of ankle (situation),Sufficiently definedsubstance,708558004,Amoxicillin + clavulanate (substance),Primitiveorganism,708559007,Genus Fontibacillus (organism),Primitiveorganism,708560002,Fontibacillus panacisegetis (organism),Primitivesubstance,708561003,Bromhexine (substance),Primitivesubstance,708562005,Xantinol nicotinate (substance),Primitivesubstance,708563000,Tuaminoheptane sulfate (substance),Primitiveorganism,708564006,Fontibacillus aquaticus (organism),Primitivesubstance,708565007,Phenylalanine + tyrosine (substance),Primitiveorganism,708566008,Acinetobacter indicus (organism),Primitiveorganism,708567004,Bacteroides massiliensis (organism),Primitiveorganism,708568009,Vibrio azureus (organism),Primitiveorganism,708569001,Tessaracoccus oleiagri (organism),Primitiveorganism,708570000,Streptococcus rubneri (organism),Primitivefinding,708571001,Demonstrates knowledge of who to contact in medical emergency (finding),Primitivesubstance,708572008,Dihydroergocryptine mesylate (substance),Primitivemorphologic abnormality,708573003,Cavitated caries (morphologic abnormality),Primitivemorphologic abnormality,708574009,Non-cavitated caries (morphologic abnormality),Primitivemorphologic abnormality,708575005,Secondary caries (morphologic abnormality),Primitivemorphologic abnormality,708576006,Primary caries (morphologic abnormality),Primitivemorphologic abnormality,708577002,Non-active caries (morphologic abnormality),Primitivemorphologic abnormality,708578007,Active caries (morphologic abnormality),Primitivebody structure,708579004,Inner third of dentin (body structure),Primitivebody structure,708580001,Middle third of dentin (body structure),Primitivebody structure,708581002,Outer third of dentin (body structure),Primitivebody structure,708582009,Inner half of dentin (body structure),Primitivebody structure,708583004,Outer half of dentin (body structure),Primitivebody structure,708584005,Inner half of enamel (body structure),Primitivebody structure,708585006,Outer half of enamel (body structure),Primitivebody structure,708586007,Dentinopulpal junction (body structure),Primitiveprocedure,708587003,Marsupialization of abscess of pharynx (procedure),Sufficiently definedprocedure,708588008,Marsupialization of abscess of nasopharynx (procedure),Sufficiently definedprocedure,708589000,Laparoscopic resection of segment of liver (procedure),Sufficiently definedprocedure,708590009,Laparoscopic wedge resection of liver (procedure),Sufficiently definedfinding,708592001,Non-metallic colored dental restoration present (finding),Primitivefinding,708593006,Metallic colored dental restoration present (finding),Primitivefinding,708594000,Indirect dental restoration present (finding),Primitivefinding,708595004,Direct dental restoration present (finding),Primitivefinding,708596003,Loss of access hole filling (finding),Primitivesubstance,708597007,Adenosine triphosphate disodium (substance),Primitivesubstance,708598002,Cefditoren (substance),Primitivesubstance,708599005,Methoxyphenamine hydrochloride (substance),Primitivesubstance,708600008,Menadione sodium bisulfite (substance),Primitiveprocedure,708601007,Percutaneous drainage of extraperitoneal abscess (procedure),Sufficiently definedprocedure,708602000,Percutaneous fine needle aspiration biopsy of humerus using imaging guidance (procedure),Sufficiently definedprocedure,708603005,Percutaneous fine needle aspiration biopsy of tarsus using imaging guidance (procedure),Sufficiently definedprocedure,708604004,Percutaneous fine needle aspiration biopsy of vertebra using imaging guidance (procedure),Sufficiently definedprocedure,708605003,Percutaneous fine needle aspiration biopsy of joint structure of shoulder using imaging guidance (procedure),Sufficiently definedprocedure,708606002,Percutaneous fine needle aspiration biopsy of joint of hip using imaging guidance (procedure),Sufficiently definedprocedure,708607006,Percutaneous fine needle aspiration biopsy of joint of knee using imaging guidance (procedure),Sufficiently definedprocedure,708608001,Percutaneous fine needle aspiration biopsy of soft tissue using imaging guidance (procedure),Sufficiently definedprocedure,708609009,Percutaneous drainage of joint of finger using imaging guidance (procedure),Sufficiently definedsituation,70861000119106,History of gastroesophageal reflux disease (situation),Sufficiently definedprocedure,708610004,Percutaneous drainage of joint of hip using imaging guidance (procedure),Sufficiently definedprocedure,708611000,Percutaneous drainage of joint of knee using imaging guidance (procedure),Sufficiently definedprocedure,708612007,Percutaneous drainage of abscess of liver (procedure),Sufficiently definedprocedure,708613002,Percutaneous drainage of abscess of peritoneum (procedure),Sufficiently definedprocedure,708614008,Laparoscopic lysis of adhesion of peritoneum (procedure),Sufficiently definedsubstance,708615009,beta-Cortolone (substance),Primitiveprocedure,708616005,Biopsy of perirectal tissue (procedure),Sufficiently definedsubstance,708617001,Sennoside B (substance),Primitiveprocedure,708618006,Aspiration of testis (procedure),Sufficiently definedprocedure,708619003,Open biopsy of testis (procedure),Sufficiently definedprocedure,708620009,Repair of scrotum and tunica vaginalis (procedure),Sufficiently definedprocedure,708621008,Insertion of stent into urethra (procedure),Sufficiently definedprocedure,708622001,Local excision of lesion of prostate (procedure),Sufficiently definedprocedure,708623006,Removal of calculus of urethra (procedure),Sufficiently definedprocedure,708624000,Transurethral biopsy of bladder (procedure),Sufficiently definedprocedure,708625004,Open radiofrequency ablation of lesion of liver (procedure),Sufficiently definedprocedure,708626003,Suture of laceration of scrotum and tunica vaginalis (procedure),Sufficiently definedprocedure,708627007,Laparoscopic excision of small intestine (procedure),Sufficiently definedprocedure,708628002,Laparoscopic biopsy of lesion of peritoneum (procedure),Sufficiently definedprocedure,708629005,Laparoscopic bypass gastrojejunostomy (procedure),Sufficiently definedprocedure,708630000,Open drainage of abscess of liver (procedure),Sufficiently definedprocedure,708631001,Laparoscopic-assisted low anterior resection of rectum (procedure),Sufficiently definedprocedure,708632008,Laparoscopic incision and exploration of common bile duct (procedure),Sufficiently definedprocedure,708633003,Laparoscopic gastropexy (procedure),Sufficiently definedprocedure,708634009,Excision of sacrococcygeal teratoma (procedure),Primitiveprocedure,708635005,Suture of laceration of vas deferens and epididymis (procedure),Sufficiently definedprocedure,708636006,Open drainage of intraperitoneal abscess (procedure),Sufficiently definedfinding,708637002,Increased incisal display at rest (finding),Primitivefinding,708638007,Decreased incisal display at rest (finding),Primitiveprocedure,708639004,Excision of intramuscular lipoma (procedure),Sufficiently definedprocedure,708640002,Laparoscopic exploration of common bile duct using robotic assistance (procedure),Sufficiently definedprocedure,708641003,Thoracoscopic repair of congenital diaphragmatic hernia (procedure),Sufficiently definedprocedure,708642005,Laparoscopic fixation of rectum using robotic assistance (procedure),Sufficiently definedprocedure,708643000,Laparoscopic proximal subtotal gastrectomy using robotic assistance (procedure),Sufficiently definedprocedure,708644006,Laparoscopic closure of ulcer of stomach using patch (procedure),Sufficiently definedprocedure,708645007,Laparoscopic closure of ulcer of duodenum using patch (procedure),Sufficiently definedprocedure,708646008,Laparotomy with biopsy of peritoneum (procedure),Sufficiently definedprocedure,708647004,Laparotomy with biopsy of omentum (procedure),Sufficiently definedprocedure,708648009,Laparotomy with biopsy of pancreas (procedure),Sufficiently definedprocedure,708649001,Division of tendon of neck (procedure),Sufficiently definedprocedure,708650001,Excision of part of phalanx of hand (procedure),Sufficiently definedprocedure,708651002,Partial excision of vertebra (procedure),Sufficiently definedprocedure,708652009,Narcotics education (procedure),Primitivedisorder,708653004,Gingival disease due to drug (disorder),Sufficiently defineddisorder,708654005,Convergent root proximity (disorder),Primitivedisorder,708655006,Necrosis following injection of local anesthetic (disorder),Primitiveprocedure,708656007,Dual energy X-ray absorptiometry scan of wrist (procedure),Primitivesubstance,708657003,beta Tryptase (substance),Primitivesubstance,708658008,Zinc amino acid chelate (substance),Primitivephysical object,708659000,Window trough (physical object),Primitivephysical object,708660005,Window sill (physical object),Primitivesubstance,708661009,Tribenoside (substance),Primitivesubstance,708662002,Tretoquinol (substance),Primitivesubstance,708663007,Tretoquinol hydrochloride (substance),Primitivesubstance,708664001,Mature tryptase (substance),Primitivesubstance,708665000,Alanine + cystine + histidine + homocysteine + leucine + phenylalanine + tyrosine (substance),Primitiveprocedure,708666004,Ultrasound guided injection of botulinum toxin (procedure),Sufficiently definedfinding,708667008,Increased gonial angle (finding),Sufficiently definedfinding,708668003,Decreased gonial angle (finding),Sufficiently defineddisorder,708669006,Bifid mandibular condyle (disorder),Sufficiently definedfinding,708670007,Anteverted nostril (finding),Primitivefinding,708671006,Decreased incisal display on smiling (finding),Primitivedisorder,708672004,Odontohypophosphatasia (disorder),Primitivedisorder,708673009,Parosmia (disorder),Primitivedisorder,708674003,Hemimaxillofacial dysplasia (disorder),Primitiveobservable entity,708675002,Gonial angle (observable entity),Primitivebody structure,708676001,Structure of mandibular fossa (body structure),Primitivedisorder,708677005,Congenital malformation of mandibular glenoid fossa (disorder),Sufficiently definedprocedure,708678000,Percutaneous fine needle aspiration biopsy of vulva using imaging guidance (procedure),Sufficiently definedprocedure,708679008,Percutaneous drainage of kidney using imaging guidance (procedure),Sufficiently definedprocedure,708680006,Percutaneous drainage of peritoneum using imaging guidance (procedure),Sufficiently definedprocedure,708681005,Percutaneous drainage of retroperitoneum using imaging guidance (procedure),Sufficiently definedprocedure,708682003,Percutaneous drainage of pelvic cavity using imaging guidance (procedure),Sufficiently definedprocedure,708683008,Percutaneous drainage of pancreas using imaging guidance (procedure),Sufficiently definedprocedure,708684002,Percutaneous drainage of gallbladder using imaging guidance (procedure),Sufficiently definedobservable entity,708685001,Mandibular plane angle (observable entity),Primitivefinding,708686000,Hyperdivergent mandibular plane angle (finding),Sufficiently definedprocedure,708687009,Percutaneous fine needle aspiration biopsy of pelvic cavity using imaging guidance (procedure),Sufficiently definedprocedure,708688004,Percutaneous fine needle aspiration biopsy of kidney using imaging guidance (procedure),Sufficiently definedprocedure,708689007,Removal of loose suture in eye (procedure),Primitiveprocedure,708690003,Dual energy X-ray photon absorptiometry scan of spine (procedure),Primitiveprocedure,708691004,Somatosensory evoked potential study (procedure),Primitiveprocedure,708692006,Intraoperative brainstem auditory evoked potential test (procedure),Primitiveprocedure,708693001,Percutaneous fine needle aspiration biopsy of abdominal wall using imaging guidance (procedure),Sufficiently definedprocedure,708694007,Percutaneous fine needle aspiration biopsy of bone marrow using imaging guidance (procedure),Sufficiently definedprocedure,708695008,Percutaneous fine needle aspiration biopsy of rectum using imaging guidance (procedure),Sufficiently definedprocedure,708697000,Percutaneous fine needle aspiration biopsy of liver using imaging guidance (procedure),Sufficiently definedprocedure,708698005,Percutaneous fine needle aspiration biopsy of pancreas using imaging guidance (procedure),Sufficiently definedfinding,708699002,Stool DNA-based colorectal cancer screening positive (finding),Primitivephysical object,708700001,Private water well (physical object),Primitiveprocedure,708701002,Percutaneous fine needle aspiration biopsy of peritoneum using imaging guidance (procedure),Sufficiently definedprocedure,708702009,Percutaneous fine needle aspiration biopsy of lymphatic structure using imaging guidance (procedure),Sufficiently definedsubstance,708703004,Tocotrienol (substance),Primitivesubstance,708704005,Threitol (substance),Primitivesubstance,708705006,Sulfogaiacol (substance),Primitivesubstance,708706007,Suberate unsaturated (substance),Primitiveprocedure,708707003,Intraoperative electromyography (procedure),Primitivesubstance,708708008,Tricarboxylporphyrin 1 (substance),Primitivesubstance,708709000,Tricarboxylporphyrin 3 (substance),Primitivesituation,70871000119100,History of irritable bowel syndrome (situation),Sufficiently definedsubstance,708710005,Transforming growth factor beta 1 (substance),Primitivesubstance,708711009,Trametinib (substance),Primitivesubstance,708712002,Tiglylcarnitine (substance),Primitivesubstance,708713007,Taliglucerase alfa (substance),Primitivesubstance,708714001,Suvorexant (substance),Primitivesubstance,708715000,15-Anhydrosorbitol (substance),Primitivesubstance,708716004,Androstenedione + 17-Hydroxyprogesterone (substance),Primitivesubstance,708717008,Vortioxetine (substance),Primitivesubstance,708718003,Vorapaxar (substance),Primitivesubstance,708719006,Pregnanetriolone (substance),Primitivesubstance,708720000,2-Hydroxyestrone (substance),Primitivesubstance,708721001,2-Methylglutarate (substance),Primitivephysical object,708722008,Municipal water system and well (physical object),Primitivesubstance,708723003,Magnesium acetate (substance),Primitivesubstance,708724009,16 alpha-hydroxyestrone (substance),Primitivesubstance,708725005,16-alpha-Hydroxypregnenolone (substance),Primitivesubstance,708726006,16 alpha-hydroxydehydroepiandrosterone (substance),Primitivesubstance,708727002,Dehydroepiandrosterone unconjugated (substance),Primitivedisorder,708728007,Traumatic brain injury of unknown intent (disorder),Primitiveprocedure,708729004,Extensive debulking of neoplasm of abdominal cavity (procedure),Primitiveprocedure,708730009,Open incision of liver (procedure),Sufficiently definedprocedure,708731008,Endoscopic insertion of nasobiliary drainage tube (procedure),Primitiveprocedure,708732001,Intraoperative somatosensory evoked potential study (procedure),Primitiveprocedure,708733006,Angiography of liver (procedure),Sufficiently definedprocedure,708734000,X-ray of prostate and seminal vesicles (procedure),Sufficiently definedassessment scale,708735004,Epworth Sleepiness Scale (assessment scale),Primitiveassessment scale,708736003,Follicular Lymphoma International Prognostic Index (assessment scale),Primitiveprocedure,708737007,Stripping of larynx (procedure),Sufficiently definedprocedure,708738002,Excisional debridement of burn involving less than 5% of body surface (procedure),Primitiveprocedure,708739005,Biopsy of lesion of oral cavity (procedure),Sufficiently definedprocedure,708740007,Biopsy of buccal mucosa (procedure),Sufficiently definedprocedure,708741006,Biopsy of soft palate (procedure),Sufficiently definedprocedure,708742004,Fiberoptic laryngoscopy with biopsy (procedure),Sufficiently definedprocedure,708743009,Thoracoscopic biopsy of pericardium (procedure),Sufficiently defined