semtag,id,term,DefStatusorganism,709679001,Escherichia coli serotype O132:H34 (organism),Primitiveorganism,709680003,Escherichia coli serotype O1:H7 (organism),Primitiveorganism,709681004,Rhinolophus bat coronavirus HKU2 (organism),Primitiveorganism,709682006,Mycobacterium iranicum (organism),Primitiveorganism,709683001,Escherichia coli serotype O86:H18 (organism),Primitiveorganism,709684007,Genus Alloprevotella (organism),Primitiveorganism,709685008,Massilia brevitalea (organism),Primitiveorganism,709686009,Genus Thermomyces (organism),Primitivedisorder,709687000,Chronic deep vein thrombosis of pelvic vein (disorder),Sufficiently definedprocedure,709688005,Drainage of pericardium using fluoroscopic guidance (procedure),Sufficiently definedprocedure,709689002,Drainage of limb using fluoroscopic guidance (procedure),Sufficiently definedprocedure,709690006,Drainage of bladder using fluoroscopic guidance (procedure),Sufficiently definedprocedure,709691005,Drainage of limb using ultrasonographic guidance (procedure),Sufficiently definedsubstance,709693008,Antibody to Babesia bovis (substance),Primitivesubstance,709695001,Antibody to Babesia divergens (substance),Primitivesubstance,709696000,Antibody to Babesia duncani (substance),Primitiveprocedure,709697009,Computed tomography of ileal conduit (procedure),Sufficiently definedprocedure,709698004,Computed tomography of lumbar spine and sacroiliac joint with contrast (procedure),Sufficiently definedprocedure,709699007,Computed tomography of tooth (procedure),Sufficiently definedprocedure,709700008,Computed tomography of limb with contrast (procedure),Sufficiently definedsubstance,709701007,Antibody to Influenzavirus A H1 (substance),Primitivesubstance,709702000,Antibody to Influenzavirus A H10 (substance),Primitivesubstance,709703005,Antibody to Influenzavirus A H11 (substance),Primitivesubstance,709704004,Antibody to Influenzavirus A H12 (substance),Primitivesubstance,709705003,Antibody to Influenzavirus A H13 (substance),Primitivesubstance,709706002,Antibody to Influenzavirus A H14 (substance),Primitivesubstance,709707006,Antibody to Influenzavirus A H15 (substance),Primitivesubstance,709708001,Antibody to Influenzavirus A H16 (substance),Primitivesubstance,709709009,Antibody to Influenzavirus A H2 (substance),Primitivesubstance,709710004,Antibody to Influenzavirus A H3 (substance),Primitivesubstance,709711000,Antibody to Influenzavirus A H4 (substance),Primitivesubstance,709712007,Antibody to Influenzavirus A H5 (substance),Primitivesubstance,709713002,Antibody to Influenzavirus A H6 (substance),Primitivesubstance,709714008,Antibody to Influenzavirus A H7 (substance),Primitivesubstance,709715009,Antibody to Influenzavirus A H8 (substance),Primitivesubstance,709716005,Antibody to Influenzavirus A H9 (substance),Primitivesubstance,709717001,Antibody to Influenzavirus A N2 (substance),Primitivesubstance,709718006,Antibody to Influenzavirus A N3 (substance),Primitivesubstance,709719003,Antibody to Influenzavirus A N4 (substance),Primitivesubstance,709720009,Antibody to Influenzavirus A N5 (substance),Primitivesubstance,709721008,Antibody to Influenzavirus A N6 (substance),Primitivesubstance,709722001,Antibody to Influenzavirus A N7 (substance),Primitivesubstance,709723006,Antibody to Influenzavirus A N8 (substance),Primitivesubstance,709724000,Antibody to Influenzavirus A N9 (substance),Primitivesubstance,709726003,Antibody to Borrelia burgdorferi C6 (substance),Primitivesubstance,709727007,Antibody to Leptospira borgpetersenii serovar Ballum (substance),Primitivesubstance,709728002,Antibody to Leptospira borgpetersenii serovar Sejroe (substance),Primitivesubstance,709729005,Antibody to Leptospira interrogans serovar Australis (substance),Primitivesubstance,709730000,Antibody to Leptospira interrogans serovar Autumnalis (substance),Primitivesubstance,709731001,Antibody to Leptospira interrogans serovar Bulgarica (substance),Primitivesubstance,709732008,Antibody to Leptospira interrogans serovar Ballum (substance),Primitivesubstance,709733003,Antibody to Leptospira interrogans serovar Celledoni (substance),Primitivesubstance,709734009,Antibody to Leptospira interrogans serovar Copenhageni (substance),Primitivesubstance,709735005,Antibody to Leptospira interrogans serovar Cynopteri (substance),Primitivesubstance,709736006,Antibody to Leptospira interrogans serovar Djasiman (substance),Primitivesubstance,709737002,Antibody to Leptospira interrogans serovar Hebdomadis (substance),Primitivesubstance,709738007,Antibody to Leptospira interrogans serovar Javanica (substance),Primitivesubstance,709739004,Antibody to Leptospira interrogans serovar Kremastos (substance),Primitivesubstance,709740002,Antibody to Leptospira interrogans serovar Manhao (substance),Primitivesubstance,709741003,Antibody to Leptospira interrogans serovar Medanensis (substance),Primitivesubstance,709742005,Antibody to Leptospira interrogans serovar Mini (substance),Primitivesubstance,709743000,Antibody to Leptospira interrogans serovar Panama (substance),Primitivesubstance,709744006,Antibody to Leptospira interrogans serovar Pyrogenes (substance),Primitivesubstance,709745007,Antibody to Leptospira interrogans serovar Robinsoni (substance),Primitivesubstance,709746008,Antibody to Leptospira interrogans serovar Sejroe (substance),Primitivesubstance,709747004,Antibody to Leptospira interrogans serovar Shermani (substance),Primitivesubstance,709748009,Antibody to Leptospira interrogans serovar Szwajizak (substance),Primitivesubstance,709749001,Antibody to Leptospira interrogans serovar Tarassovi (substance),Primitivesubstance,709750001,Antibody to Leptospira interrogans serovar Zanoni (substance),Primitiveprocedure,709753004,Liaising with social worker (procedure),Primitiveprocedure,709754005,Liaising with religious service (procedure),Primitiveprocedure,709755006,Liaising with physician (procedure),Primitiveprocedure,709756007,Liaising with pain management specialist (procedure),Primitiveprocedure,709757003,Liaising with pharmacist (procedure),Primitiveprocedure,709758008,Liaising with education service (procedure),Primitivesubstance,709759000,Helminth antigen (substance),Primitivesubstance,709760005,Cestode antigen (substance),Primitivesubstance,709761009,Trematode antigen (substance),Primitivesubstance,709762002,Nematode antigen (substance),Primitiveprocedure,709763007,Liaising with nutritionist (procedure),Primitiveprocedure,709764001,Liaising with legal service (procedure),Primitiveprocedure,709765000,Evaluation of psychosocial response to instruction (procedure),Primitiveprocedure,709766004,Computed tomography of axilla with contrast (procedure),Sufficiently definedprocedure,709767008,Computed tomography of vascular structure of pelvis (procedure),Sufficiently definedprocedure,709768003,Computed tomography angiography of artery of limb (procedure),Sufficiently definedsubstance,709769006,Antibody to Actinobacillus pleuropneumoniae serovar 7 (substance),Primitivesubstance,709770007,Antibody to Actinobacillus pleuropneumoniae serovar 5 (substance),Primitivesubstance,709771006,Antibody to Actinobacillus pleuropneumoniae serovar 1 (substance),Primitiveprocedure,709772004,Computed tomography of coccyx with contrast (procedure),Sufficiently definedsubstance,709774003,Antibody to Actinomyces israelii (substance),Primitivesubstance,709775002,Antibody to Aspergillus clavatus (substance),Primitivesubstance,709776001,Antibody to Aspergillus nidulans (substance),Primitivesubstance,709777005,Antibody to Aspergillus terreus (substance),Primitivesubstance,709783008,Antibody to Bordetella bronchiseptica (substance),Primitivesubstance,709784002,Antibody to Bordetella pertussis Yamaguchi (substance),Primitivesubstance,709785001,Antibody to Campylobacter fetus (substance),Primitivesubstance,709786000,Antibody to Campylobacter fetus subspecies venerealis (substance),Primitiveprocedure,709787009,Thoracentesis using computed tomography guidance (procedure),Sufficiently definedsubstance,709789007,Antibody to Ehrlichia ruminantium (substance),Primitivesubstance,709790003,Antibody to Coxsackievirus A3 (substance),Primitivesubstance,709791004,Antibody to Coxsackievirus A6 (substance),Primitivesubstance,709792006,Antibody to Coxsackievirus A8 (substance),Primitivesubstance,709793001,Antibody to Cryptostroma corticale (substance),Primitivesubstance,709796009,Antibody to Sin Nombre virus (substance),Primitivesubstance,709797000,Antibody to Histoplasma capsulatum variant farciminosum (substance),Primitivesubstance,709798005,Antibody to Histoplasma capsulatum H (substance),Primitivesubstance,709799002,Antibody to Histoplasma capsulatum M (substance),Primitivesubstance,709801004,Antibody to Legionella micdadei (substance),Primitivesubstance,709803001,Antibody to Mycobacterium tuberculosis A60 (substance),Primitivesubstance,709805008,Antibody to Mycoplasma arginini (substance),Primitivesubstance,709806009,Antibody to Mycoplasma bovis (substance),Primitivesubstance,709813009,Antibody to Neisseria meningitidis w135 (substance),Primitivesubstance,709814003,Antibody to Orientia tsutsugamushi Gilliam (substance),Primitivesubstance,709815002,Antibody to Orientia tsutsugamushi Karp (substance),Primitivesubstance,709816001,Antibody to Orientia tsutsugamushi Kato (substance),Primitivesubstance,709817005,Antibody to Penicillium notatum (substance),Primitivesubstance,709820002,Antibody to Rickettsia akari (substance),Primitivesubstance,709821003,Antibody to Rickettsia honei (substance),Primitivesubstance,709822005,Antibody to Rickettsia sibirica (substance),Primitivesubstance,709823000,Antibody to Salmonella abortusequi (substance),Primitivesubstance,709824006,Antibody to Salmonella abortusovis (substance),Primitivesubstance,709825007,Antibody to Salmonella pullorum (substance),Primitivesubstance,709826008,Antibody to Schistosoma haematobium (substance),Primitivesubstance,709827004,Antibody to Swine vesicular disease virus (substance),Primitivesubstance,709828009,Antibody to West Nile virus NS5 (substance),Primitivesubstance,709829001,Antibody to Yersinia enterocolitica O527 (substance),Primitivedisorder,709830006,Malignant carcinoid tumor of stomach (disorder),Primitivesubstance,709831005,Antibody to Hepatitis C virus E2 (substance),Primitivesubstance,709832003,Antibody to Hepatitis C virus NS3 (substance),Primitivesubstance,709833008,Antibody to Hepatitis C virus NS4 (substance),Primitivesubstance,709834002,Antibody to Hepatitis C virus NS5 (substance),Primitivesubstance,709835001,Antibody to Streptococcus pneumoniae 18 (substance),Primitivesubstance,709836000,Antibody to human immunodeficiency virus type I protein 40 (substance),Primitivesubstance,709837009,Antibody to human immunodeficiency virus type II glycoprotein 140 (substance),Primitivesubstance,709838004,Antibody to human immunodeficiency virus type II protein 16 (substance),Primitivesubstance,709839007,Antibody to human immunodeficiency virus type I glycoprotein 40 (substance),Primitivesubstance,709840009,8-Hydroxy-deoxyguanosine (substance),Primitivesubstance,709841008,Triglyceride in chylomicrons (substance),Primitivesubstance,709842001,Deoxyinosine (substance),Primitivesubstance,709843006,Deoxyguanosine (substance),Primitivesubstance,709844000,N-carbamoyl-beta-alanine (substance),Primitiveprocedure,709845004,Magnetic resonance imaging of limb with contrast (procedure),Sufficiently definedfinding,709846003,Ideal single arch location and extent of edentulous area of oral cavity (finding),Primitivefinding,709847007,Minimally compromised location and extent of edentulous area of oral cavity (finding),Primitivefinding,709848002,Moderately compromised location and extent of edentulous area of oral cavity (finding),Primitivefinding,709849005,Severely compromised location and extent of edentulous area of oral cavity (finding),Primitivefinding,709850005,Substantially compromised location and extent of edentulous area of oral cavity (finding),Primitiveprocedure,709851009,Drainage of lumbar region using fluoroscopic guidance (procedure),Sufficiently defineddisorder,709852002,Galvanic lesion of oral cavity (disorder),Primitiveorganism,709853007,Canis lupus dingo (organism),Primitivesubstance,709854001,Antibody to Actinobacillus pleuropneumoniae serovar 3 (substance),Primitiveprocedure,709855000,Finger brachial pressure index (procedure),Primitiveprocedure,709856004,Wrist brachial pressure index (procedure),Primitiveprocedure,709857008,Repair of aneurysm of aorta using fluoroscopic guidance (procedure),Sufficiently definedprocedure,709858003,Aspiration of joint using ultrasonographic guidance (procedure),Sufficiently definedprocedure,709859006,Radionuclide scan of joint of knee (procedure),Sufficiently definedprocedure,709860001,Angioplasty of superior vena cava using fluoroscopic guidance (procedure),Sufficiently definedprocedure,709861002,Angioplasty of abdominal aorta using fluoroscopic guidance (procedure),Sufficiently definedprocedure,709862009,Angioplasty of arteriovenous fistula using fluoroscopic guidance (procedure),Sufficiently definedprocedure,709863004,Angioplasty of abdominal vascular structure (procedure),Sufficiently definedprocedure,709864005,Assessment using Vanderbilt Assessment Scale (procedure),Primitivesubstance,709865006,Antibody to Alternaria alternata (substance),Primitivesubstance,709866007,Antibody to Rhizomucor pusillus (substance),Primitivesubstance,709867003,Antibody to Rhizopus arrhizus (substance),Primitivesubstance,709868008,Antibody to Trichoderma viride (substance),Primitivesubstance,709869000,Antibody to Chlamydophila (substance),Primitivesubstance,709870004,Antibody to Neorickettsia risticii (substance),Primitivesubstance,709871000,Antibody to Absidia corymbifera (substance),Primitivesubstance,709872007,Antibody to Bartonella elizabethae (substance),Primitivesubstance,709873002,Antibody to Burkholderia mallei (substance),Primitivesubstance,709874008,Antibody to Dermatophilus congolensis (substance),Primitivesubstance,709875009,Antibody to Mycobacterium avium subspecies avium (substance),Primitivesubstance,709876005,Antibody to Mycobacterium bovis (substance),Primitivesubstance,709877001,Antibody to Rhodococcus equi (substance),Primitivesubstance,709878006,Antibody to Tropheryma whippelii (substance),Primitivefinding,709880000,Unknown handedness (finding),Primitivesituation,709881001,History of gestational hypertension (situation),Sufficiently definedsubstance,709882008,Antibody to Gnathostoma (substance),Primitivesubstance,709883003,Antibody to Angiostrongylus cantonensis (substance),Primitivesubstance,709884009,Antibody to Angiostrongylus costaricensis (substance),Primitivesubstance,709885005,Antibody to Dirofilaria immitis (substance),Primitivesubstance,709886006,Antibody to Encephalitozoon cuniculi (substance),Primitivesubstance,709887002,Antibody to Leishmania chagasi K39 (substance),Primitivesubstance,709888007,Antibody to Trypanosoma brucei gambiense (substance),Primitivesubstance,709889004,Antibody to Trypanosoma brucei rhodesiense (substance),Primitivesubstance,709891007,Antibody to Trypanosoma evansi (substance),Primitivesubstance,709892000,Antibody to Tritrichomonas foetus (substance),Primitivesubstance,709893005,Antibody to Toxocara cati (substance),Primitivesubstance,709897006,Antibody to Avian metapneumovirus (substance),Primitivesubstance,709898001,Antibody to Avian metapneumovirus type A (substance),Primitivesubstance,709899009,Antibody to Avian metapneumovirus type B (substance),Primitivesubstance,709900004,Antibody to Avian metapneumovirus type C (substance),Primitivesubstance,709901000,Antibody to Influenza virus A swine origin (substance),Primitivesubstance,709904008,Antibody to Severe acute respiratory syndrome coronavirus (substance),Primitivesubstance,709905009,Antibody to Severe acute respiratory syndrome coronavirus urbani (substance),Primitivesubstance,709909003,Antibody to Aino virus (substance),Primitivesubstance,709912000,Antibody to Avian paramyxovirus 6 (substance),Primitivesubstance,709913005,Antibody to Avian paramyxovirus 7 (substance),Primitivesubstance,709914004,Antibody to Avian paramyxovirus 8 (substance),Primitivesubstance,709915003,Antibody to Avian paramyxovirus 9 (substance),Primitivesubstance,709916002,Antibody to Banzi virus (substance),Primitivesubstance,709917006,Antibody to Bebaru virus (substance),Primitivesubstance,709918001,Antibody to BK virus (substance),Primitivesubstance,709920003,Antibody to Borna disease virus (substance),Primitivesubstance,709930007,Antibody to Encephalomyocarditis virus (substance),Primitivesubstance,709931006,Antibody to Ephemeral fever virus (substance),Primitivesubstance,709945000,Antibody to Filovirus (substance),Primitivesubstance,709946004,Antibody to Foot and mouth disease virus (substance),Primitivesubstance,709948003,Antibody to Getah virus (substance),Primitivesubstance,709950006,Antibody to Highlands J virus (substance),Primitivesubstance,709951005,Antibody to Jamestown canyon virus (substance),Primitivesubstance,709952003,Antibody to JC virus (substance),Primitivesubstance,709954002,Antibody to Myxoma virus (substance),Primitivesubstance,709955001,Antibody to Nairobi sheep disease virus (substance),Primitivesubstance,709958004,Antibody to Papova virus SV40 (substance),Primitivesubstance,709959007,Antibody to Parainfluenza virus (substance),Primitivesubstance,709961003,Antibody to Porcine adenovirus (substance),Primitivesubstance,709962005,Antibody to Porcine respiratory coronavirus (substance),Primitivesubstance,709963000,Antibody to Powassan virus (substance),Primitivesubstance,709965007,Antibody to Rift valley fever virus (substance),Primitivesubstance,709967004,Antibody to Ross river virus (substance),Primitivesubstance,709968009,Antibody to Semliki forest virus (substance),Primitivesubstance,709969001,Antibody to Snowshoe hare virus (substance),Primitivesubstance,709970000,Antibody to Vesicular stomatitis Alagoas virus (substance),Primitivesubstance,709971001,Antibody to Vesicular stomatitis Indiana virus (substance),Primitivesubstance,709972008,Antibody to Vesicular stomatitis New Jersey virus (substance),Primitivesubstance,709973003,Antibody to Vesicular stomatitis virus (substance),Primitivesubstance,709974009,Antibody to Trivittatus virus (substance),Primitivesubstance,709976006,Antibody to Hepatitis G virus E2 (substance),Primitivedisorder,709977002,Mucous patch of oral mucosa (disorder),Sufficiently defineddisorder,709978007,Contracted kidney (disorder),Primitiveprocedure,709979004,Doppler ultrasonography of artery (procedure),Sufficiently definedprocedure,709980001,Procedure on fallopian tube using fluoroscopic guidance (procedure),Sufficiently definedprocedure,709981002,Coronary artery atherectomy using fluoroscopic guidance (procedure),Sufficiently definedprocedure,709982009,Radionuclide scan of joint of hip (procedure),Sufficiently definedprocedure,709983004,Pleurodesis using fluoroscopic guidance (procedure),Sufficiently definedobservable entity,709984005,Occlusal scheme (observable entity),Primitivefinding,709986007,Moderately compromised dentate occlusal scheme (finding),Primitivefinding,709987003,Moderately compromised occlusal scheme (finding),Primitivefinding,709988008,Moderately compromised partially dentate occlusal scheme (finding),Primitivefinding,709989000,Severely compromised dentate occlusal scheme (finding),Primitiveprocedure,709990009,Aspiration of breast using fluoroscopic guidance (procedure),Sufficiently definedfinding,709991008,Severely compromised occlusal scheme (finding),Primitivefinding,709992001,Severely compromised partially dentate occlusal scheme (finding),Primitivefinding,709993006,Substantially compromised dentate occlusal scheme (finding),Primitivefinding,709994000,Substantially compromised occlusal scheme (finding),Primitivefinding,709995004,Substantially compromised partially dentate occlusal scheme (finding),Primitiveprocedure,709996003,Ultrasonography of pseudoaneurysm (procedure),Sufficiently definedfinding,709997007,Steep mandibular plane angle (finding),Primitivedisorder,709999005,Molariform supernumerary tooth (disorder),Primitivedisorder,710000001,Spontaneous lingual mandibular sequestrum (disorder),Primitiveobservable entity,710001002,Tooth number (observable entity),Primitivefinding,710002009,Missing dentition by tooth number (finding),Primitivedisorder,710003004,Transient lingual papillitis (disorder),Sufficiently definedobservable entity,710004005,Retruded to maximum intercuspation (observable entity),Primitiveprocedure,710005006,Referral to physical training instructor (procedure),Primitivefinding,710006007,Form of tooth (finding),Primitivefinding,710007003,Abnormal form of tooth (finding),Primitivedisorder,710008008,Monosomy X (disorder),Primitivefinding,710009000,Maxilla residual ridge morphology with tori present (finding),Primitivedisorder,710010005,Mosaic Turner syndrome (disorder),Primitivefinding,710011009,Edentulous muscle attachment (finding),Primitivefinding,710012002,Edentulous muscle attachment with adequate attached mucosal base (finding),Primitivefinding,710013007,Edentulous muscle attachment with attached mucosal base only in posterior lingual region (finding),Primitivefinding,710014001,Edentulous muscle attachment with high genioglossus attachment (finding),Primitivefinding,710015000,Edentulous muscle attachment with high mentalis attachment (finding),Primitivefinding,710016004,Edentulous muscle attachment with no attached mucosa in any region (finding),Primitivefinding,710017008,Edentulous muscle attachment with no attached mucosal base in mandibular anterior region (finding),Primitivefinding,710018003,Edentulous muscle attachment with no attached mucosal base mandibular anterior and lingual vestibule (finding),Primitivedisorder,710019006,Mosaicism 45 X or other cell line with abnormal sex chromosome (disorder),Primitivefinding,710020000,Maxilla residual ridge morphology with prominent anterior nasal spine (finding),Primitivefinding,710021001,Maxilla residual ridge morphology with minimal resistance to palatal vault (finding),Primitivefinding,710022008,Maxilla residual ridge morphology without palatal vault resistance to horizontal or vertical movement (finding),Primitivefinding,710023003,Maxilla residual ridge morphology with no buccal vestibule present (finding),Primitivefinding,710024009,Maxilla residual ridge morphology with hyperplastic mobile anterior ridge (finding),Primitivefinding,710025005,Maxilla residual ridge morphology with hamular notch present (finding),Primitivefinding,710026006,Maxilla residual ridge morphology with redundant tissue present (finding),Primitivedisorder,710027002,Cytokine-associated toxicity (disorder),Primitivequalifier value,710028007,Maxillofacial surgery service (qualifier value),Primitivequalifier value,710029004,Taut (qualifier value),Primitivefinding,710030009,Maxilla residual ridge morphology with reduction of post malar space (finding),Primitivefinding,710031008,Inducible ischemia manifest on stress test post myocardial infarction (finding),Primitivefinding,710032001,Maxilla residual ridge morphology with absent anterior labial vestibule (finding),Primitivefinding,710033006,Maxilla residual ridge morphology with poor hamular notch (finding),Primitiveevent,710034000,Exposure to Influenzavirus (event),Sufficiently definedsubstance,710035004,Star fruit (substance),Primitivesubstance,710036003,Beetroot seed (substance),Primitivesubstance,710037007,Beta-lactoglobulin (substance),Primitivesubstance,710038002,Bovine lactoferrin (substance),Sufficiently definedsubstance,710039005,Rape seed (substance),Primitivesubstance,710040007,Chili pepper (substance),Primitivesubstance,710041006,Gorgonzola cheese (substance),Primitivesubstance,710042004,Conalbumin (substance),Primitivesubstance,710043009,Saffron - dietary (substance),Primitivesubstance,710044003,European eel - dietary (substance),Primitiveprocedure,710045002,Screening for abuse (procedure),Sufficiently defineddisorder,710046001,Refractory idiopathic generalized epilepsy (disorder),Sufficiently definedprocedure,710047005,Management of negative response to treatment (procedure),Primitivesubstance,710048000,Japanese millet (substance),Primitivesubstance,710049008,Cardamon (substance),Primitivesubstance,710050008,Anchovy - dietary (substance),Primitivesubstance,710051007,Selenomethionine (substance),Primitivedisorder,710052000,Pathological fracture of distal radius and distal ulna (disorder),Sufficiently defineddisorder,710053005,Nontraumatic subarachnoid intracranial hemorrhage (disorder),Sufficiently definedprocedure,710054004,Maintaining integrity of skin (procedure),Primitiveprocedure,710055003,Management of aggressive behavior (procedure),Sufficiently definedprocedure,710056002,Management of impulse control (procedure),Sufficiently definedprocedure,710057006,Management of inappropriate sexual behavior (procedure),Sufficiently definedprocedure,710058001,Management of vasopneumatic device (procedure),Primitiveprocedure,710059009,Management of withdrawal symptom (procedure),Sufficiently definedprocedure,710060004,Management of anxiety (procedure),Sufficiently definedprocedure,710061000,Management of depressed mood with postpartum onset (procedure),Sufficiently definedprocedure,710062007,Management of coping impairment (procedure),Sufficiently definedregime/therapy,710063002,Nephrostomy care (regime/therapy),Primitiveprocedure,710064008,Management of nephrostomy care (procedure),Sufficiently definedfinding,710065009,Child-Pugh score class A (finding),Primitive