semtag,id,term,DefStatussubstance,710680002,Immunoglobulin M antibody to Plasmodium malariae (substance),Primitivesubstance,710681003,Immunoglobulin M antibody to Polio virus (substance),Primitiveprocedure,710682005,Education about peristomal skin complications (procedure),Sufficiently definedsubstance,710683000,Immunoglobulin M antibody to Respiratory syncytial virus (substance),Primitivesubstance,710684006,Immunoglobulin M antibody to Rickettsia conorii (substance),Primitivesubstance,710685007,Immunoglobulin M antibody to Rickettsia prowazekii (substance),Primitivesubstance,710686008,Immunoglobulin M antibody to Rickettsia rickettsii (substance),Primitivesubstance,710687004,Immunoglobulin M antibody to Rickettsia (substance),Primitivesubstance,710688009,Immunoglobulin M antibody to Rickettsia spotted fever group (substance),Primitivesubstance,710689001,Immunoglobulin M antibody to Rickettsia typhi (substance),Primitivesubstance,710690005,Immunoglobulin M antibody to Rickettsia typhus group (substance),Primitivesubstance,710691009,Immunoglobulin M antibody to Rotavirus (substance),Primitivesubstance,710692002,Immunoglobulin M antibody to Rubella virus (substance),Primitivesubstance,710693007,Immunoglobulin M antibody to Saint Louis encephalitis virus (substance),Primitivesubstance,710694001,Immunoglobulin M antibody to Salmonella (substance),Primitivesubstance,710695000,Immunoglobulin M antibody to Schistosoma (substance),Primitivesubstance,710696004,Immunoglobulin M antibody to Sporothrix schenckii (substance),Primitivesubstance,710697008,Immunoglobulin M antibody to Streptococcus pneumoniae (substance),Primitivesubstance,710698003,Immunoglobulin M antibody to Toxocara canis (substance),Primitivesubstance,710699006,Immunoglobulin M antibody to Toxoplasma gondii (substance),Primitivesubstance,710700007,Immunoglobulin M antibody to Treponema pallidum (substance),Primitivesubstance,710701006,Immunoglobulin M antibody to Trichinella (substance),Primitivesubstance,710702004,Immunoglobulin M antibody to Trichinella spiralis (substance),Primitivesubstance,710703009,Immunoglobulin M antibody to Trypanosoma cruzi (substance),Primitivesubstance,710704003,Immunoglobulin M antibody to Varicella zoster virus (substance),Primitivesubstance,710705002,Immunoglobulin M antibody to Venezuelan equine encephalitis virus (substance),Primitivesubstance,710706001,Immunoglobulin M antibody to West Nile virus (substance),Primitivesubstance,710707005,Immunoglobulin M antibody to Western equine encephalitis virus (substance),Primitivesubstance,710708000,Immunoglobulin M antibody to Yellow fever virus (substance),Primitiveprocedure,710709008,Education about sexual behavior (procedure),Primitivesubstance,710710003,Immunoglobulin M antibody to Yersinia enterocolitica (substance),Primitivesubstance,710711004,Immunoglobulin M antibody to Yersinia (substance),Primitivesubstance,710712006,False oat grass pollen (substance),Primitivemorphologic abnormality,710713001,Multinodular oncocytic hyperplasia (morphologic abnormality),Primitivesubstance,710714007,Salt grass pollen (substance),Primitivesubstance,710715008,Barley pollen (substance),Primitiveprocedure,710716009,Education about breast care during postpartum period (procedure),Primitiveprocedure,710717000,Education about breast care during prenatal period (procedure),Primitiveprocedure,710718005,Education about family process (procedure),Primitiveprocedure,710720008,Education about head lice infestation (procedure),Sufficiently definedsubstance,710721007,Horse chestnut pollen (substance),Primitivesubstance,710722000,Grey alder pollen (substance),Primitivesubstance,710723005,Horn beam pollen (substance),Primitivesubstance,710724004,Australian palm pollen (substance),Primitivesubstance,710725003,Sweet chestnut pollen (substance),Primitivesubstance,710726002,Sweet gum tree pollen (substance),Primitivedisorder,710727006,Enlargement of root of tongue (disorder),Sufficiently defineddisorder,710728001,Elevation of tongue (disorder),Sufficiently defineddisorder,710729009,Woody tongue (disorder),Primitivesubstance,710730004,Canary island date palm pollen (substance),Primitivesubstance,710731000,London plane pollen (substance),Primitivesubstance,710732007,Douglas fir pollen (substance),Primitivedisorder,710733002,Chronic gout without tophus (disorder),Primitivedisorder,710734008,Secondary chronic gout without tophus (disorder),Sufficiently defineddisorder,710735009,Periodontitis co-occurrent with leukocyte adhesion deficiency (disorder),Primitiveprocedure,710736005,Education about relapse prevention (procedure),Sufficiently definedprocedure,710737001,Education about risk reduction technique (procedure),Primitiveprocedure,710738006,Education about symptom control (procedure),Primitivesituation,710739003,Education of caregiver about toilet training (situation),Sufficiently definedsituation,710740001,Education of caregiver about weaning (situation),Sufficiently definedsituation,710741002,Education of community about disease (situation),Sufficiently definedsituation,710742009,Family education about community services (situation),Sufficiently definedprocedure,710743004,Education about delirium (procedure),Sufficiently definedsituation,710744005,Family education about delirium (situation),Sufficiently definedsituation,710745006,Family education about device (situation),Sufficiently definedsituation,710746007,Family education about diagnostic test (situation),Sufficiently definedsituation,710747003,Family education about dietary regime (situation),Sufficiently definedsubstance,710748008,T-cell receptor excision circle (substance),Primitivesubstance,710749000,Soluble mesothelin related protein (substance),Primitivesubstance,710750000,Remnant lipoprotein (substance),Primitiveproduct,710751001,Amoxicillin trihydrate 200mg tablet for oral suspension (product),Primitiveproduct,710752008,Amoxicillin trihydrate 400mg tablet for oral suspension (product),Primitivesituation,710753003,Family education about hygiene (situation),Sufficiently definedsituation,710754009,Family education about fall prevention (situation),Sufficiently definedsituation,710755005,Family education about disease (situation),Sufficiently definedprocedure,710756006,Education about electrolyte therapy (procedure),Sufficiently definedsituation,710757002,Family education about electrolyte therapy (situation),Sufficiently definedfinding,710758007,Right deviation of uvula (finding),Primitivefinding,710759004,Left deviation of uvula (finding),Primitivenamespace concept,710760009,Extension Namespace {1000180} (namespace concept),Primitivenamespace concept,710761008,Extension Namespace {1000181} (namespace concept),Primitivenamespace concept,710762001,Extension Namespace {1000182} (namespace concept),Primitivefinding,710763006,Independent in cooking (finding),Sufficiently definedobservable entity,710764000,Edentulous maxillomandibular relationship (observable entity),Primitivesituation,710765004,Wound drain discontinued (situation),Sufficiently definedregime/therapy,710766003,Implementation of immunization regime (regime/therapy),Primitiveregime/therapy,710767007,Implementation of physical restraint regime (regime/therapy),Primitiveregime/therapy,710768002,Implementation of seizure management regime (regime/therapy),Primitiveregime/therapy,710769005,Implementation of safety regime (regime/therapy),Primitiveprocedure,710770006,Identification of risk of hemorrhage (procedure),Primitiveprocedure,710771005,Identification of preoperative cardiac status (procedure),Primitiveprocedure,710772003,Identification of preoperative endocrine status (procedure),Primitiveprocedure,710773008,Identification of preoperative gastrointestinal status (procedure),Primitiveprocedure,710774002,Identification of preoperative genitourinary status (procedure),Primitiveprocedure,710775001,Identification of preoperative musculoskeletal status (procedure),Primitiveprocedure,710776000,Identification of preoperative physiological status (procedure),Primitiveprocedure,710777009,Identification of preoperative respiratory status (procedure),Primitiveprocedure,710778004,Identification of preoperative tissue perfusion (procedure),Primitivedisorder,710779007,Reflux of urine (disorder),Primitivefinding,710780005,Increased posterior face height (finding),Primitivefinding,710781009,Deep mentolabial sulcus (finding),Primitivedisorder,710782002,Malocclusion Angle class II subdivision (disorder),Primitivefinding,710783007,Removable partial denture with loss of occlusal relationship (finding),Primitivefinding,710784001,Removable partial denture with loss of retention (finding),Primitiveprocedure,710785000,Laparoscopic repair of hernia (procedure),Sufficiently defineddisorder,710786004,Gingivitis due to disorder of cellular component of blood (disorder),Sufficiently definedqualifier value,710787008,Subxiphoid approach (qualifier value),Primitiveprocedure,710788003,Biopsy of pericardium by subxiphoid approach (procedure),Sufficiently defineddisorder,710789006,Extensive root caries lesion involving dentin (disorder),Primitiveprocedure,710790002,Puncture and aspiration using ultrasonographic guidance (procedure),Sufficiently definedprocedure,710791003,Puncture and aspiration using computed tomography guidance (procedure),Sufficiently definedprocedure,710792005,Puncture and aspiration using fluoroscopic guidance (procedure),Sufficiently definedobservable entity,710793000,Cant of occlusal plane (observable entity),Primitiveprocedure,710794006,Computed tomography of feeding tube (procedure),Sufficiently definedfinding,710795007,Inadequate dietary energy intake (finding),Sufficiently definedprocedure,710796008,Aspiration of cyst of kidney using fluoroscopic guidance (procedure),Sufficiently definedprocedure,710797004,Intramedullary nailing of fracture of bone using fluoroscopic guidance (procedure),Sufficiently defineddisorder,710798009,Juvenile hemangioendothelioma (disorder),Primitiveobservable entity,710799001,Width of canine tooth (observable entity),Primitiveobservable entity,710800002,Width of molar tooth (observable entity),Primitiveobservable entity,710801003,Width of periodontal ligament (observable entity),Primitiveprocedure,710802005,Assisting health care provider (procedure),Primitiveprocedure,710803000,Assistance with mobility (procedure),Primitiveprocedure,710804006,Assistance with walking using device (procedure),Primitivesubstance,710805007,RNA polymerase inhibitor (substance),Primitivesubstance,710806008,Sofosbuvir (substance),Primitivesubstance,710807004,Teduglutide (substance),Primitivesubstance,710808009,Polystyrene sulfonate (substance),Primitivesubstance,710809001,Levothyroxine (substance),Primitivesubstance,710810006,Gadobenic acid (substance),Primitivesubstance,710811005,Gadopentetic acid (substance),Primitivesubstance,710812003,Gadoteric acid (substance),Primitivedisorder,710813008,Dactylitis of toe (disorder),Sufficiently definedsituation,710814002,Long-term current use of drug therapy (situation),Sufficiently definedsituation,710815001,Long-term current use of insulin (situation),Sufficiently definedsituation,710816000,Long-term current use of steroid (situation),Sufficiently definedsituation,710817009,Long-term current use of inhaled steroid (situation),Sufficiently definedprocedure,710818004,Inhaled steroid therapy (procedure),Sufficiently definedregime/therapy,710819007,Support for dignified dying (regime/therapy),Primitiveregime/therapy,710820001,Support of beliefs (regime/therapy),Primitiveregime/therapy,710821002,Support of spiritual ritual (regime/therapy),Primitiveprocedure,710822009,Education about community services (procedure),Primitiveprocedure,710823004,Education about diagnostic test (procedure),Primitiveprocedure,710824005,Assessment of health and social care needs (procedure),Primitiveprocedure,710825006,Education about breathing technique (procedure),Primitiveprocedure,710826007,Education about adaptation techniques for sensory deficit (procedure),Primitiveprocedure,710827003,Education about wound healing (procedure),Primitiveprocedure,710828008,Assessment of ability to walk (procedure),Primitiveprocedure,710829000,Assessment of active range of motion (procedure),Primitiveprocedure,710830005,Assessment of passive range of motion (procedure),Primitiveprocedure,710831009,Assessment of adherence to immunization regime (procedure),Primitiveprocedure,710832002,Assessment of aggressive behavior (procedure),Sufficiently definedprocedure,710833007,Assessment of attitude toward disease (procedure),Primitiveprocedure,710834001,Assessment of attitude toward health status (procedure),Primitiveprocedure,710835000,Assessment of attitude toward medication management (procedure),Primitiveprocedure,710836004,Assessment of attitude toward nutritional status (procedure),Primitiveprocedure,710837008,Assessment of attitude toward treatment regime (procedure),Primitiveprocedure,710838003,Assessment of barriers to adherence (procedure),Primitiveprocedure,710839006,Assessment of cardiac status using monitoring device (procedure),Primitivesituation,710840008,Assessment of caregiver knowledge (situation),Primitiveprocedure,710841007,Assessment of anxiety (procedure),Sufficiently definedprocedure,710842000,Assessment of caregiver stress (procedure),Primitiveprocedure,710843005,Assessment of cultural beliefs (procedure),Primitiveprocedure,710844004,Assessment of death tradition (procedure),Primitiveprocedure,710845003,Assessment of decision making ability (procedure),Sufficiently definedprocedure,710846002,Assessment of depressed mood (procedure),Sufficiently definedprocedure,710847006,Assessment of dietary need (procedure),Primitiveprocedure,710848001,Assessment of eating and drinking behavior (procedure),Primitiveprocedure,710849009,Assessment of exercise behavior (procedure),Primitiveprocedure,710850009,Assessment of expectations (procedure),Primitivesituation,710851008,Assessment of family coping behavior (situation),Sufficiently definedprocedure,710852001,Assessment of financial status (procedure),Primitiveprocedure,710853006,Assessment of fluid balance (procedure),Sufficiently definedprocedure,710854000,Assessment of family process (procedure),Primitiveprocedure,710855004,Assessment for sign of discomfort (procedure),Primitiveprocedure,710856003,Assessment of grief (procedure),Primitiveprocedure,710858002,Assessment of knowledge of medication regime (procedure),Primitiveprocedure,710859005,Assessment of knowledge of pain management (procedure),Primitiveprocedure,710860000,Assessment of knowledge of patient controlled analgesia (procedure),Primitiveprocedure,710861001,Assessment of knowledge of traditional therapy (procedure),Primitiveprocedure,710862008,Assessment of medication supply (procedure),Primitivebody structure,710863003,Structure of wall of artery (body structure),Primitivedisorder,710864009,Dissection of artery (disorder),Sufficiently definedregime/therapy,710865005,Support for family mourning process (regime/therapy),Primitiveregime/therapy,710866006,Support for use of traditional therapy (regime/therapy),Primitiveregime/therapy,710867002,Support for family decision making process (regime/therapy),Primitivebody structure,710868007,Entire wall of artery (body structure),Primitiveregime/therapy,710869004,Support for family coping process (regime/therapy),Primitiveregime/therapy,710870003,Support for caregiver during weaning (regime/therapy),Primitiveregime/therapy,710871004,Support for caregiver during toilet training (regime/therapy),Primitiveregime/therapy,710872006,Regimen management support (regime/therapy),Primitiveprocedure,710873001,Involving client in decision making process (procedure),Primitiveprocedure,710874007,Education about cross infection prevention (procedure),Primitiveorganism,710875008,Fluoroquinolone resistant bacteria (organism),Primitiveprocedure,710876009,Education about ambulation technique (procedure),Primitiveorganism,710877000,Beta lactam resistant bacteria (organism),Primitivedisorder,710878005,Mahaim fibre tachycardia (disorder),Primitiveprocedure,710879002,Education of parent about caregiver child attachment (procedure),Primitiveprocedure,710880004,Education about dying process (procedure),Primitiveprocedure,710881000,Education about eating pattern (procedure),Primitiveprocedure,710882007,Education about effective communication (procedure),Primitiveprocedure,710883002,Education about increasing activity tolerance (procedure),Primitiveprocedure,710884008,Education about managing withdrawal symptoms (procedure),Primitiveprocedure,710885009,Education about medication handling (procedure),Primitiveorganism,710886005,Escherichia coli 987P (organism),Primitiveorganism,710887001,Escherichia coli F41 (organism),Primitiveorganism,710888006,Escherichia coli K88 (organism),Primitiveorganism,710889003,Escherichia coli K99 (organism),Primitiveprocedure,710890007,Education about mobilizing device (procedure),Primitiveorganism,710891006,Methicillin resistant Staphylococcus (organism),Primitiveprocedure,710892004,Education about stoma complications (procedure),Primitiveprocedure,710893009,Education about substance abuse (procedure),Sufficiently definedsubstance,710894003,Lenscale pollen (substance),Primitiveprocedure,710895002,Education about use of covering device (procedure),Primitiveprocedure,710896001,Education about use of supporting device (procedure),Primitiveprocedure,710897005,Education about water supply (procedure),Primitivesubstance,710898000,Beta vulgaris pollen (substance),Primitiveprocedure,710899008,Education about adaptation technique (procedure),Primitivesubstance,710900003,Sunflower pollen (substance),Primitivesubstance,710901004,Lupin pollen (substance),Primitivesubstance,710902006,Chamomile pollen (substance),Primitivedisorder,710903001,Periodontitis co-occurrent with genetic disorder (disorder),Sufficiently definedsubstance,710904007,Parietaria judaica pollen (substance),Primitivesubstance,710905008,Parietaria officinalis pollen (substance),Primitivedisorder,710906009,Oral leukoplakia co-occurrent with Sanguinaria (disorder),Sufficiently definedsubstance,710907000,Goldenrod pollen (substance),Primitiveprocedure,710908005,Referral to self help service (procedure),Primitiveprocedure,710909002,Referral to chaplaincy service (procedure),Primitiveprocedure,710910007,Referral to legal service (procedure),Primitiveprocedure,710911006,Referral to housing service (procedure),Primitiveprocedure,710912004,Referral to funeral service (procedure),Primitiveprocedure,710913009,Referral to financial service (procedure),Primitiveprocedure,710914003,Referral to family therapy (procedure),Primitiveprocedure,710915002,Referral to community service (procedure),Primitiveprocedure,710916001,Referral to breastfeeding education class during prenatal period (procedure),Primitiveprocedure,710917005,Provision of transcutaneous electrical nerve stimulation device (procedure),Sufficiently definedprocedure,710918000,Provision of safety device (procedure),Primitiveprocedure,710919008,Provision of privacy for spiritual behavior (procedure),Primitiveprocedure,710920002,Provision of privacy (procedure),Primitiveprocedure,710921003,Provision of health promotion service for child development (procedure),Primitivesituation,710922005,Provision of anticipatory guidance to family (situation),Primitiveprocedure,710923000,Provision of bedtime routine (procedure),Primitiveprocedure,710924006,Provision of adequate water supply (procedure),Primitiveprocedure,710925007,Provision of food (procedure),Primitivedisorder,710926008,Periodontitis co-occurrent with familial neutropenia (disorder),Sufficiently defineddisorder,710927004,Periodontitis co-occurrent with cyclical neutropenia (disorder),Sufficiently definedproduct,710928009,Flower and weed pollen diagnostic allergen extract (product),Sufficiently definedsubstance,710929001,Mosquito salivary protein (substance),Primitivesubstance,710930006,German cockroach protein (substance),Primitivesubstance,710931005,Oriental cockroach protein (substance),Primitivesubstance,710932003,Moth protein (substance),Primitivesubstance,710933008,Blood worm protein (substance),Primitivesubstance,710934002,Green nimitti protein (substance),Primitivesubstance,710935001,Mediterranean flour moth protein (substance),Primitivesubstance,710936000,Horse bot fly protein (substance),Primitivesubstance,710937009,American cockroach protein (substance),Primitivesubstance,710938004,Grain weevil protein (substance),Primitivesubstance,710939007,Fire ant venom (substance),Primitivesubstance,710940009,Tabanus species salivary protein (substance),Primitivesubstance,710941008,Berlin beetle protein (substance),Primitivesubstance,710942001,Insect protein (substance),Primitivesubstance,710943006,Cockroach protein (substance),Primitivedisorder,710944000,Inflammation of fetal umbilical artery (disorder),Sufficiently definedsubstance,710945004,Dibunate (substance),Primitivesubstance,710946003,Sodium dibunate (substance),Primitivesubstance,710947007,Azapentacene (substance),Primitivesubstance,710948002,Azapentacene sulfonate sodium (substance),Primitivesubstance,710949005,Calcium amino acid chelate (substance),Primitiveregime/therapy,710950005,Progressive mobility (regime/therapy),Primitiveprocedure,710951009,Arranging transportation of device (procedure),Primitiveprocedure,710952002,Advocating for breastfeeding (procedure),Primitiveprocedure,710953007,Management of administration of blood product (procedure),Sufficiently definedfinding,710954001,Bacteria present (finding),Sufficiently definedprocedure,710955000,Biomedical equipment procedure (procedure),Sufficiently definedprocedure,710956004,Checking device safety (procedure),Primitiveprocedure,710957008,Assessment of inhalation technique (procedure),Sufficiently definedprocedure,710958003,Checking patient identity (procedure),Primitiveregime/therapy,710959006,Implementation of immobilization regime (regime/therapy),Primitiveprocedure,710960001,Moving patient using transfer technique (procedure),Primitiveprocedure,710961002,Use of supportive positioning (procedure),Primitiveprocedure,710962009,Management of financial circumstance (procedure),Primitiveprocedure,710963004,Management of incontinence appliance regime (procedure),Primitiveprocedure,710964005,Management of negative response to situation (procedure),Primitiveprocedure,710965006,Management of negative emotional state (procedure),Primitiveprocedure,710966007,Management of negative behavior (procedure),Primitiveprocedure,710967003,Management of health status after discharge from hospital (procedure),Primitiveregime/therapy,710968008,Defecation care (regime/therapy),Primitiveprocedure,710969000,Management of defecation (procedure),Primitiveprocedure,710970004,Prenatal assessment of breastfeeding (procedure),Primitiveprocedure,710971000,Maintaining clear airway (procedure),Primitiveprocedure,710972007,Maintaining fall safety alarm (procedure),Primitiveprocedure,710973002,Prevention of unwanted pregnancy (procedure),Sufficiently definedprocedure,710974008,Prevention of osteoporosis (procedure),Sufficiently definedprocedure,710975009,Reinforcement of self efficacy (procedure),Primitiveprocedure,710976005,Maintaining ventilation (procedure),Primitiveprocedure,710977001,Safe storage and management of medication (procedure),Primitiveprocedure,710978006,Minimizing environmental stimuli (procedure),Primitiveregime/therapy,710979003,Observation of altered perception (regime/therapy),Primitiveprocedure,710980000,Prevention of cross infection (procedure),Sufficiently definedprocedure,710981001,Prioritizing treatment regime (procedure),Primitiveprocedure,710982008,Education about administration of blood product (procedure),Sufficiently definedsituation,710983003,Family education about administration of blood product (situation),Sufficiently definedprocedure,710984009,Reinforcement of achievement (procedure),Primitiveregime/therapy,710985005,Traditional therapy (regime/therapy),Primitiveregime/therapy,710986006,Monitoring drug withdrawal (regime/therapy),Primitiveregime/therapy,710987002,Monitoring patient location using an exit alarm (regime/therapy),Primitiveregime/therapy,710988007,Monitoring of tissue perfusion (regime/therapy),Primitivesituation,710989004,Family education about fluid therapy (situation),Sufficiently definedprocedure,710990008,Education about fluid therapy (procedure),Sufficiently definedregime/therapy,710991007,Monitoring for risk of complications of nurse-controlled analgesia (regime/therapy),Primitiveregime/therapy,710992000,Monitoring for risk of complications of patient-controlled analgesia (regime/therapy),Primitiveregime/therapy,710993005,Monitoring response to treatment (regime/therapy),Primitiveregime/therapy,710994004,Monitoring pedal pulse (regime/therapy),Primitiveregime/therapy,710995003,Monitoring pain (regime/therapy),Primitiveregime/therapy,710996002,Monitoring height (regime/therapy),Primitiveregime/therapy,710997006,Monitoring for impaired family coping (regime/therapy),Primitiveregime/therapy,710998001,Monitoring for child abuse (regime/therapy),Primitiveregime/therapy,710999009,Monitoring food intake (regime/therapy),Primitiveregime/therapy,711000008,Monitoring fluid output (regime/therapy),Primitiveregime/therapy,711001007,Monitoring fluid intake (regime/therapy),Primitiveregime/therapy,711002000,Monitoring fall risk (regime/therapy),Primitiveregime/therapy,711003005,Monitoring bowel motility (regime/therapy),Primitiveregime/therapy,711004004,Monitoring activity tolerance (regime/therapy),Primitive